{
  "$schema": "../config/schemas/marketplace.json",
  "name": "rldyour-claudecode",
  "owner": {
    "name": "Danil Silantyev (github:rldyourmnd), CEO NDDev",
    "url": "https://github.com/rldyourmnd"
  },
  "description": "rldyour AI CLI configuration for Claude Code: plugin marketplace, MCP/LSP, Serena memory, security review, browser/design workflows, and reviewer agents. RU: конфигурация Claude Code для rldyour AI CLI: marketplace плагинов, Serena, MCP/LSP, безопасность, браузер/дизайн и reviewer agents.",
  "plugins": [
    {
      "name": "rldyour-mcps",
      "source": "./plugins/rldyour-mcps",
      "description": "Транспортный слой MCP - 10 серверов с зафиксированными версиями: Serena, Sequential Thinking, Chrome DevTools, Context7, DeepWiki, Grep, shadcn, Dart/Flutter, Figma, OpenAI Docs.",
      "version": "1.8.12",
      "author": {
        "name": "Danil Silantyev (github:rldyourmnd), CEO NDDev"
      },
      "category": "infrastructure",
      "tags": [
        "mcp",
        "transport",
        "rldyour"
      ],
      "license": "AGPL-3.0-or-later"
    },
    {
      "name": "rldyour-explore",
      "source": "./plugins/rldyour-explore",
      "description": "Скиллы технического и веб-исследования + ry-explore субагент глубокого анализа (Opus 4.8 1M via opus[1m], max effort) через Context7/DeepWiki/Grep MCP. /ry-explore slash command included.",
      "version": "1.8.12",
      "author": {
        "name": "Danil Silantyev (github:rldyourmnd), CEO NDDev"
      },
      "category": "research",
      "tags": [
        "research",
        "explore",
        "mcp",
        "context7",
        "deepwiki",
        "grep",
        "rldyour"
      ],
      "license": "AGPL-3.0-or-later"
    },
    {
      "name": "rldyour-serena-mcp",
      "source": "./plugins/rldyour-serena-mcp",
      "description": "Семантический воркфлоу через Serena MCP + .serena memory sync markers. UserPromptSubmit/PreToolUse/PostToolUse hooks only; Stop orchestration belongs to rldyour-flow.",
      "version": "1.8.12",
      "author": {
        "name": "Danil Silantyev (github:rldyourmnd), CEO NDDev"
      },
      "category": "development",
      "tags": [
        "serena",
        "mcp",
        "lsp",
        "code-workflow",
        "memories",
        "hooks",
        "rldyour"
      ],
      "license": "AGPL-3.0-or-later"
    },
    {
      "name": "rldyour-security",
      "source": "./plugins/rldyour-security",
      "description": "Безопасность по OWASP Top 10 2025 при реализации + защитный Mythos-style security review через /ry-sec-review slash command.",
      "version": "1.8.12",
      "author": {
        "name": "Danil Silantyev (github:rldyourmnd), CEO NDDev"
      },
      "category": "security",
      "tags": [
        "security",
        "owasp",
        "asvs",
        "ry-sec-review",
        "vulnerability-review",
        "rldyour"
      ],
      "license": "AGPL-3.0-or-later"
    },
    {
      "name": "rldyour-browser",
      "source": "./plugins/rldyour-browser",
      "description": "Fail-closed CloakBrowser workflows through exact managed Playwright CLI and Chrome DevTools MCP transports; Webwright runtime and fallbacks are forbidden.",
      "version": "1.8.12",
      "author": {
        "name": "Danil Silantyev (github:rldyourmnd), CEO NDDev"
      },
      "category": "development",
      "tags": [
        "browser",
        "playwright",
        "chrome-devtools",
        "mcp",
        "ui-validation",
        "browser-debug",
        "rldyour"
      ],
      "license": "AGPL-3.0-or-later"
    },
    {
      "name": "rldyour-design",
      "source": "./plugins/rldyour-design",
      "description": "Сквозной дизайн-воркфлоу: Figma → код → токены → FSD → shadcn/ui → ReactBits → browser-валидация. 5 скиллов + /ry-design. Skills-only - MCP transport from rldyour-mcps.",
      "version": "1.8.12",
      "author": {
        "name": "Danil Silantyev (github:rldyourmnd), CEO NDDev"
      },
      "category": "design",
      "tags": [
        "design",
        "figma",
        "shadcn",
        "reactbits",
        "fsd",
        "design-system",
        "tokens",
        "ry-design",
        "rldyour"
      ],
      "license": "AGPL-3.0-or-later"
    },
    {
      "name": "rldyour-lsps",
      "source": "./plugins/rldyour-lsps",
      "description": "LSP-воркфлоу: маршрутизация, health-check, brew-first установка, Serena LSP integration. 4 skills + 2 scripts + 3 references. Покрывает Python/Rust/Dart/TS/Go/C++/Qt/YAML/Docker/HTML/CSS/Shell/JSON/TOML/Markdown.",
      "version": "1.8.12",
      "author": {
        "name": "Danil Silantyev (github:rldyourmnd), CEO NDDev"
      },
      "category": "development",
      "tags": [
        "lsp",
        "language-server",
        "serena",
        "pyright",
        "typescript-language-server",
        "rust-analyzer",
        "gopls",
        "clangd",
        "rldyour"
      ],
      "license": "AGPL-3.0-or-later"
    },
    {
      "name": "rldyour-flow",
      "source": "./plugins/rldyour-flow",
      "description": "Автономный SDLC-воркфлоу: ry-init/start/newp/review/deploy/sync + 6 reviewer subagents + post-task-sync + instruction-docs-sync. Хуки SessionStart/PreToolUse/PostToolUse/Stop. Tracked AI context on main.",
      "version": "1.8.12",
      "author": {
        "name": "Danil Silantyev (github:rldyourmnd), CEO NDDev"
      },
      "category": "development",
      "tags": [
        "sdlc",
        "workflow",
        "ry-init",
        "ry-start",
        "ry-review",
        "ry-deploy",
        "ry-sync",
        "reviewer",
        "rldyour"
      ],
      "license": "AGPL-3.0-or-later"
    },
    {
      "name": "rldyour-orchestrator",
      "source": "./plugins/rldyour-orchestrator",
      "description": "macOS cmux orchestrator-режим: оркестратор-терминал делегирует worker-терминалам через cmux send/read-screen/events; роль активируется декларацией в /ry-init. Устанавливается только на macOS.",
      "version": "1.8.12",
      "author": {
        "name": "Danil Silantyev (github:rldyourmnd), CEO NDDev"
      },
      "category": "development",
      "tags": [
        "cmux",
        "orchestrator",
        "worker",
        "macos",
        "multi-agent",
        "terminal",
        "rldyour"
      ],
      "license": "AGPL-3.0-or-later"
    },
    {
      "name": "rldyour-rules",
      "source": "./plugins/rldyour-rules",
      "description": "Quality-first инженерные правила: clean architecture (FSD/VSA/Hexagonal), implementation discipline, dependency policy + supply chain (SLSA L2), verification gates (pyright/ruff/ESLint v9), AGENTS.md/.claude/CLAUDE.md/MADR 4.0.0, /ry-rules-review.",
      "version": "1.8.12",
      "author": {
        "name": "Danil Silantyev (github:rldyourmnd), CEO NDDev"
      },
      "category": "development",
      "tags": [
        "rules",
        "quality",
        "fsd",
        "vsa",
        "hexagonal",
        "supply-chain",
        "slsa",
        "adr",
        "ry-rules-review",
        "rldyour"
      ],
      "license": "AGPL-3.0-or-later"
    }
  ]
}
